{
  "name": "Example Project",
  "website": "https://example-project.com",
  "description": "An example DeFi protocol on VinuChain demonstrating the token list format",
  "contact": "contact@example-project.com",
  "security": "security@example-project.com",
  "token": {
    "chainId": 26600,
    "address": "0x5aAeb6053F3E94C9b9A09f33669435E7Ef1BeAed",
    "symbol": "EXAMPLE",
    "name": "Example Token",
    "decimals": 18,
    "logoURI": "https://example-project.com/logo.png"
  },
  "social": {
    "github": "https://github.com/example-project",
    "twitter": "https://twitter.com/exampleproject",
    "telegram": "https://t.me/exampleproject",
    "discord": "https://discord.gg/exampleproject",
    "medium": "https://medium.com/@exampleproject"
  }
}
